☐,81,Compact Case Study Cards on Key Pages,Site Wide,High,Mid,"Place small case study cards with a customer name, result, and a 'Read story' link on your homepage, product pages, and pricing page. Each card should include at least one number. Distributed proof points convert better than a single case study page.",https://www.brex.com/ ,,Not Started
☐,82,Live Review Platform Widget,Site Wide,Mid,Mid,"Embed a live G2 or Capterra widget on your homepage and pricing page. Live widgets pull recent reviews dynamically, which means the review content on your page stays fresh without manual updates.",https://www.chargebee.com/ ,,Not Started
☐,83,Media Mention Logo Bar,Site Wide,Mid,Low,"If your product has been featured in industry publications, podcasts, or newsletters, add an 'As seen in' bar with their logos. Named media references are an authority signal for buyers evaluating your credibility.",,,Not Started
☐,84,Specific Customer Usage Statistics,Site Wide,High,Low,"Display specific numbers like '14,500 active users', '200 million in revenue tracked', or '4.2 million tasks completed'. Round numbers feel invented. Specific numbers feel factual and are more persuasive.",https://www.okta.com/,,Not Started
☐,85,Named Quotes from Recognisable Companies,Site Wide,Mid,Low,Replace anonymous or obscure quotes with quotes from companies your ICP will recognise. One quote from a well-known brand in your buyer's sector is worth far more than ten from unknowns.,https://linear.app/ ,,Not Started
☐,86,Awards and Analyst Recognition Badges,Site Wide,Low,Low,"Show G2, Capterra, Product Hunt, Gartner, Forrester, or industry award badges where you have earned them. These carry high weight in buying decisions, especially enterprise. Only display awards you have actually received.",https://www.pandadoc.com/security/ ,,Not Started
,,,,,,,,,
🔗  CTAS AND CONVERSION ELEMENTS,,,,,,,,,
☐,87,One Primary CTA Per Page,Site Wide,High,Low,Every page should have one dominant conversion action. Multiple competing CTAs can sometimes split attention and reduce overall conversion rate.,https://linear.app/ ,,Not Started
☐,88,Outcome-Oriented CTA Copy,Site Wide,High,Low,Replace passive CTA labels like 'Submit' or 'Click Here' with outcome-based copy like 'Get My Custom Demo' or 'Start Building for Free'. Outcome-oriented CTA copy consistently outperforms generic labels in A/B tests.,https://clickup.com/brain/agents ,,Not Started
☐,89,Primary and Secondary CTA Pairing,Site Wide,Mid,Low,Pair every high-intent primary CTA like 'Book a Demo' with a lower-commitment secondary like 'Watch a 3 Minute Tour'. This captures visitors at different readiness levels. ,https://www.pandadoc.com/ ,,Not Started
☐,90,CTA Colour and Contrast Audit,Site Wide,High,Low,"Inside blog articles, use styled CTA cards with a product screenshot and a short headline rather than plain text links. Visual CTA cards stand out from the surrounding content and consistently outperform inline text links.",https://www.zendesk.com/ ,,Not Started
☐,91,Image-Backed Inline CTA Cards in Blog Content,Blog Page,High,Mid,"Inside blog articles, use styled CTA cards with a product screenshot and a short headline rather than plain text links. ",https://www.pandadoc.com/blog/how-to-write-a-proposal/ ,,Not Started
☐,92,Sticky CTA Bar on Mobile,Site Wide,High,Low,"Add a fixed bottom CTA bar on mobile that stays visible as users scroll. Mobile users expect a clear, immediate next step. A sticky bar ensures that step is never more than a thumb tap away.",,,Not Started
,,,,,,,,,
🚀  LANDING PAGES PAID AND CAMPAIGN,,,,,,,,,
☐,93,Message Match Between Ad and Landing Page,Landing Page,High,Low,The landing page headline must closely match the copy in the ad that sent the visitor there. Message mismatch is the single biggest cause of paid traffic bounce.,,,Not Started
☐,94,Single Conversion Goal Per Landing Page,Landing Page,High,Low,"Remove navigation menus and footer links from dedicated landing pages. One page, one CTA, one outcome. Removing nav alone has been shown to lift landing page conversion by 10 to 20 percent.",,,Not Started
☐,95,CTA Visible Without Scrolling on All Devices,Landing Page,High,Low,"Your form or CTA button must be fully visible without scrolling on both desktop and mobile. If a visitor has to scroll down to find the CTA, you are losing a measurable portion of your ad spend.",https://www.deel.com/ ,,Not Started
☐,96,Pain-Agitate-Solution Copy Structure,Landing Page,High,Low,"Structure landing page copy in three stages: name the pain your buyer is facing, describe the consequences of leaving it unsolved, then present your solution clearly. This structure maps directly to how B2B buyers evaluate solutions.",,,Not Started
☐,97,Social Proof Matched to the Campaign Audience,Landing Page,High,Mid,"Match testimonials and case studies to the specific audience segment the ad targets. If the ad targets HR teams, show HR testimonials. Segment-matched social proof is significantly more persuasive than generic quotes.",https://www.default.com/book-a-demo ,,Not Started
☐,98,Trust Signals Above the Fold on Landing Pages,Landing Page,High,Low,"Place your G2 rating, customer count, compliance badges, and a logo bar above the fold. Remove purchase anxiety before the visitor reads the CTA.",,,Not Started
☐,99,Short Form with 3 to 5 Fields on Paid Pages,Landing Page,High,Low,Paid landing page forms must have three to five fields maximum. Every extra field is a direct tax on your ad spend. Use enrichment tools to gather additional data post-conversion rather than asking for it upfront and losing the lead entirely.,,,Not Started
☐,100,Genuine Urgency Element When Applicable,Landing Page,Mid,Low,"If you have a real, time-limited offer, write the end date out as plain text. Fake countdown timers are not credible to experienced B2B buyers and will hurt your conversion rate.",,,Not Started
☐,101,Thank You Page with Pixel Fires and Secondary CTA,Landing Page,Mid,Mid,"Your thank you page must fire all conversion pixels for accurate attribution across Google, LinkedIn, and Meta. Include a secondary offer or recommended content to keep the new lead engaged.",,,Not Started
☐,102,Heatmap and Session Recording on Every Landing Page,Landing Page,High,Mid,"Install Hotjar or Clarity on every landing page. Paid traffic behaves differently from organic traffic. Session recordings reveal exactly where visitors stop reading, what they click on, and where they abandon the page.",,,Not Started
,,,,,,,,,
✍️  COPYWRITING AND MESSAGING,,,,,,,,,
☐,103,Voice of Customer Language Integration,Site Wide,High,Mid,"Read your G2 reviews and customer interview transcripts. Identify the exact phrases buyers use to describe their pain. Use those phrases verbatim in your headlines, feature descriptions, and testimonial selectors. Voice-of-customer language resonates because it mirrors how buyers think.",,,Not Started
☐,104,Specificity Over Generalisation in All Copy,Site Wide,High,Low,"Replace every vague benefit with a specific, measurable one. Not 'saves time' but 'saves sales reps 4.5 hours per week on manual data entry'. Specific claims are more persuasive and easier to verify.",,,Not Started
☐,105,Problem-Aware vs Solution-Aware Messaging Per Page,Site Wide,High,Mid,Top-of-funnel pages like blog posts should speak to people who know they have a problem but have not yet identified a solution. Bottom-of-funnel pages like pricing and demo should speak to people actively comparing options. Mismatched messaging to buyer stage is a common conversion killer.,,,Not Started
☐,106,Hero Headline A/B Test Cadence,Site Wide,High,High,Your headline is your highest-leverage copy asset. Run at least three to five headline variants per quarter on your homepage. Even a 10 percent improvement in headline engagement compounds across all your traffic.,,,Not Started
☐,107,Objection Pre-emption in Sales Copy,Site Wide,Mid,Low,Identify your top five sales objections from call recordings and pre-answer them in your page copy. For example: 'Too complex to set up? Most teams are live in under 15 minutes.' Pre-empting objections in copy reduces friction before buyers reach the CTA.,,,Not Started
☐,108,Clarity Over Cleverness in Headlines,Site Wide,High,Low,"Every headline must be immediately understood by your ICP on first read. Avoid clever puns or abstract concepts. If the headline is unclear to a buyer scanning the page, the rest of the copy does not matter.",,,Not Started
☐,109,Second-Person Voice Throughout,Site Wide,Mid,Low,"Write directly to the reader using 'you' and 'your team' rather than 'our customers' or 'users'. Second-person copy feels personal and relevant, which increases engagement and conversion.",,,Not Started
☐,110,Pain-First Copy Structure on Product and Feature Pages,Site Wide,High,Low,Lead with the problem before you describe the solution. Buyers need to feel understood before they consider a pitch. Problem-first copy structure consistently outperforms solution-first in B2B contexts.,,,Not Started
☐,111,Data Points and Numbers in Every Major Claim,Site Wide,High,Low,Back up every benefit claim with a number: '73 percent of customers see ROI within 90 days'. Numbers add credibility and are more persuasive than qualitative claims.,,,Not Started
☐,112,Social Proof Name-Dropping in Body Copy,Site Wide,Mid,Low,"Weave customer company names into your page copy naturally: 'Teams at Salesforce, HubSpot, and Monday.com use this to...'. Named customers in body copy build instant credibility with buyers who recognise those brands.",,,Not Started
☐,113,CTA Copy Testing Framework,Site Wide,High,Mid,"Systematically test three directions for CTA copy on each key page: benefit-focused such as 'Get My Free Trial', action-focused such as 'Start Building Now', and curiosity-focused such as 'See What Your Pipeline Could Look Like'. Document results and pick the winner each quarter.",,,Not Started
☐,114,"Navigation Labels That Describe, Not Market",Site Wide,Low,Low,Audit your navigation labels and replace vague terms like 'Solutions' or 'Platform' with descriptive ones like 'For Sales Teams' or 'CRM Integration'. Clear nav labels help buyers find what they need faster and reduce bounce.,,,Not Started
☐,115,Scannable F-Pattern Page Structure,Site Wide,Mid,Low,Structure page copy to match the F-pattern reading behaviour observed in web users: the most important content goes at the start of each line and paragraph. Bold key phrases. Keep everything left-aligned.,,,Not Started
☐,116,Avoid Jargon That Your Buyers Do Not Use,Site Wide,Mid,Low,"Audit your site for internal product terms and industry jargon that your buyers would not naturally use when searching. If a buyer would type 'tool to track sales emails' rather than 'engagement analytics platform', your copy should match their search language, not your internal naming.",,,Not Started
☐,117,"Urgency Without ""Fake"" Fomo",Site Wide,Mid,Low,"Create authentic urgency through real scarcity, real deadlines, or the cost of delay described as a consequence. Write these out as plain sentences. Never use fake countdown timers.",,,Not Started
,,,,,,,,,
🔍  SEO AND CRO ALIGNMENT,,,,,,,,,
☐,118,Keyword Intent Alignment on Every Key Page,Site Wide,High,Mid,"Map each high-traffic keyword to a buyer intent stage: awareness, consideration, or decision. Then confirm the page copy, CTA, and offer match that stage. Mismatched intent is the most common reason a high-traffic page has a low conversion rate.",,,Not Started
☐,119,Title Tags and Meta Descriptions Written as Ad Copy,Blog Page,Mid,Low,"Treat title tags and meta descriptions as ad copy. Include a benefit or a clear outcome in every meta description. A compelling meta description lifts click-through rate from search results, which drives more visitors to your conversion pages.",,,Not Started
☐,120,Core Web Vitals Pass on All Conversion Pages,Site Wide,High,High,"Achieve passing scores on all three Core Web Vitals: LCP under 2.5 seconds, INP under 200 milliseconds, and CLS under 0.1. These scores affect both Google ranking and user experience. Pages that fail CWV lose both search visibility and conversions.",,,Not Started
☐,121,Dedicated Comparison Landing Pages for VS Queries,Site Wide,High,High,Create dedicated landing pages for queries like 'X vs Competitor' and 'Best tool for Y'. These pages convert at three to five times the rate of generic pages because the visitor is already in decision mode.,,,Not Started
,,,,,,,,,
🧪  TEMPLATE AND RESOURCE PAGES,,,,,,,,,
☐,122,High-Quality Template Preview Images,Template Page,High,High,"Use professional, clean preview images for every template. The preview image is the primary conversion signal on template pages. A low-quality preview makes the template look low-quality, regardless of its actual value.",https://miro.com/templates/customer-journey-map/ ,,Not Started
☐,123,Template-Specific FAQs,Template Page,Low,Mid,"Write four to six FAQs specific to each template: how to use it, what to customise, which tool it requires, and who it was designed for. FAQ sections address objections and reduce support requests.",https://www.pandadoc.com/company-overtime-policy-template/ ,,Not Started
☐,124,Related Templates Section,Template Page,Mid,Low,Link to three or four related templates at the bottom of each page. This keeps buyers in your content ecosystem and increases the chance they find the right template for their needs.,,,Not Started
☐,125,CTA Placed Above and Below the Template Preview,Template Page,High,Low,Place your primary CTA above the fold and again after the template description. Having the CTA appear twice means visitors never have to scroll to find the download action.,https://miro.com/aq/paid-search/customer-journey-template/ ,,Not Started
☐,126,Author Attribution on Every Template,Template Page,Low,Low,Credit each template to a named team member or industry practitioner with their title and a brief credential. Named authorship builds trust and aligns with Google's E-E-A-T quality guidelines.,,,Not Started
,,,,,,,,,
,,,,,,,,,
LEGEND AND GUIDANCE,,,,,,,,,
Impact:,"High = Major lift in signups, demos, or trials.   Mid = Noticeable conversion improvement.   Low = Incremental, marginal gain.",,,,,,,,
Effort:,High = Multi-day or developer resource needed.   Mid = Half-day to full day.   Low = Quick win done in under 1 hour.,,,,,,,,
Status options:,Not Started   /   In Progress   /   In Review   /   Done   ,,,,,,,,
Prioritisation tip:,Start with High Impact and Low Effort items. These are your quick wins. Then move to High Impact and Mid Effort. Defer High Effort and Low Impact items.,,,,,,,,
,,,,,,,,,
Cadence:,Review and update this checklist in a monthly CRO meeting. Archive Done items into a separate tab each quarter.,,,,,,,,