B2B SaaS: Complete CRO  Checklist,,,,,,,,,
"120+ action items across every page type, funnel stage, and AI search signal. The only CRO checklist your B2B SaaS team needs.",,,,,,,,,
Done,#,Action Item,Page / Area,Impact,Effort,What To Do and Why It Matters,Example References,Owner,Status
🏠  HOMEPAGE,,,,,,,,,
☐,1,Hero Headline with Clear USP,Homepage,High,Low,A clear headline improves message match and helps visitors quickly understand the product’s value proposition.,https://coda.io/,,Not Started
☐,2,ICP-Specific Sub-headline,Homepage,High,Low,A supporting sentence clarifies the value proposition and reinforces relevance for the target audience.,https://asana.com/product,,Not Started
☐,3,Single Primary CTA Above the Fold,Homepage,High,Low,Put one clear action button above the fold. Use copy like 'Start Free Trial' or 'Book a Demo'. Avoid weak labels like 'Learn More'. A visible primary CTA reduces decision friction and helps high-intent visitors take action quickly.,https://www.dropbox.com/ ,,Not Started
☐,4,High-Quality Product Screenshot or UI Visual,Homepage,High,Mid,Show a real screenshot of your product UI near the top of the page. Product visuals improve clarity and help visitors understand how the product works.,https://clickup.com/ ,,Not Started
☐,5,Demo Video Near the Top,Homepage,Mid,High,"Include a short product demo video, 60 to 90 seconds. Video transcripts are increasingly indexed by AI search tools. A well-structured demo script that explains features as plain language benefits improves AI content understanding.",https://asana.com/ ,,Not Started
☐,6,Social Proof Near CTA,Homepage,High,Low,"Add a strip of real usage numbers or testimonials: for example '12,000 users, 4.8 stars on G2, 40 million in pipeline tracked' or simply testimonials with quotes, images and title of the person ",https://www.default.com/book-a-demo ,,Not Started
☐,7,Outcome-Focused Testimonial Section,Homepage,High,Low,"Show 3 to 5 testimonials that each mention a specific, measurable result. Result-driven testimonials strengthen credibility and reinforce the product’s value.",https://monday.com/ ,,Not Started
☐,8,Secondary CTA Mid-Page (pairing primary and secondary),Homepage,Mid,Low,Visitors who scroll deeper are often evaluating the product. A mid-page CTA provides a convenient way to convert once their questions are answered.,https://www.pandadoc.com/ ,,Not Started
☐,9,Sticky Navigation with CTA Button,Homepage,Mid,Low,Keep your nav bar fixed as users scroll and include your primary CTA on the right. This keeps the conversion path visible at all times. ,https://www.intercom.com/,,Not Started
☐,10,Benefits Over Features in All Copy,Homepage,High,Low,Outcome-focused messaging helps visitors understand the real value of the product rather than just its technical capabilities.,https://webflow.com ,,Not Started
☐,11,Objection-Handling Strip,Homepage,Mid,Low,"Address the top three buyer hesitations in a short section: pricing, setup time, and switching cost. ",https://monday.com/pricing ,,Not Started
☐,12,Final CTA Section with Value Restatement,Homepage,High,Low,End the page with a CTA block that restates your value prop in one sentence. Restating the value proposition near the end of the page reinforces the product’s benefit and captures visitors who are ready to take action after reviewing the content.,https://www.notion.com/ ,,Not Started
,,,,,,,,,
🧭  NAVIGATION AND SITE-WIDE,,,,,,,,,
☐,13,Contrasting CTA Button Colour,Site Wide,High,Low,"Your primary CTA button must be a colour that appears nowhere else on the page. Do a squint test: blur your eyes and see if the button still stands out. If not, change it. Clear visual hierarchy also helps ",https://www.zendesk.com/ ,,Not Started
☐,14,Micro-Copy Below Every CTA Button,Site Wide,High,Low,"Add one or two short lines under every CTA button such as 'No credit card required, setup in 5 minutes'. This copy directly removes the biggest friction points at the exact moment someone is deciding. ",https://clickup.com/features/tasks ,,Not Started
☐,15,G2 or Capterra Badges for the Current Year,Site Wide,High,Mid,"Show your most recent review platform badges near CTAs and in the header. Being visibly present on those platforms, and showing it on your site, feeds that signal.",https://instantly.ai/ ,,Not Started
☐,16,Star Rating Next to CTA,Site Wide,High,Low,"Place your aggregate review score directly beside your primary CTA buttons. Having your rating on the page in structured, crawlable text ensures it gets picked up accurately.",https://clickup.com/features/tasks,,Not Started
☐,17,Top-of-Page Announcement Banner,Site Wide,Mid,Mid,Use a dismissible banner at the top of the page for product launches or promotions. ,https://clickup.com/ ,,Not Started
☐,19,Live Chat or AI Chatbot on Key Pages,Site Wide,Mid,Mid,"Add a chat widget to pricing, demo, and product pages. Beyond answering questions live, chatbot conversation logs are a rich source of real buyer language you can use to improve your on-page copy and CTA messaging.",https://www.zendesk.com/au/pricing/ ,,Not Started
☐,20,Site-Wide Exit Intent Pop-Up,Site Wide,High,High,"Trigger a modal when a user is about to leave. Match the offer to the page they are exiting from. A well-targeted exit offer captures leads that would otherwise disappear. On blog pages, offer a relevant resource. On pricing pages, offer a direct line to sales.",https://www.semrush.com/blog/seo-checklist/ ,,Not Started
☐,21,Custom 404 Page with CTAs,Site Wide,Low,Low,"Build a branded 404 page with a search bar, links to key pages, and your primary CTA. A 404 with no useful content is a dead end. A 404 with clear links back to your site recovers visitors who would otherwise leave.",https://www.klaviyo.com/uk/404 ,,Not Started
,,,,,,,,,
💰  PRICING PAGE,,,,,,,,,
☐,22,Most Popular Plan Visual Highlight,Pricing Page,Mid,Low,Visually distinguish your recommended plan with a badge and a contrasting border. This guides buyers toward the plan that converts best and reduces decision paralysis.,https://www.lemlist.com/pricing ,,Not Started
☐,23,Annual and Monthly Toggle with Savings Shown,Pricing Page,High,Low,"Include a billing toggle and show the annual savings clearly, such as 'Save 480 per year'. Default to monthly to show the lower entry price first. Make the savings obvious enough that buyers toggle on their own.",https://slack.com/intl/en-gb/pricing ,,Not Started
☐,24,Full Feature Comparison Matrix,Pricing Page,High,Mid,Put a complete feature table below your plan cards with clear yes and no markings grouped by category. This is one of the most visited sections of any SaaS pricing page. Buyers use it to justify their decision internally.,https://www.notion.com/pricing,,Not Started
☐,25,Customer Logos and Trust Badges Near the Top,Pricing Page,High,Low,Place customer logos and/or review platform badges near the top of the pricing page. Buyers on this page have high intent. Trust signals here reduce last-minute hesitation.,https://www.lemlist.com/pricing ,,Not Started
☐,26,Money-Back Guarantee or Free Trial Terms,Pricing Page,Mid,Mid,"Display your guarantee or trial terms in plain language. Write it as a sentence or a clear badge. A clear, readable guarantee reduces perceived risk at the exact moment a buyer is deciding whether to commit.",https://clickup.com/pricing ,,Not Started
☐,27,Sales Rep Photo in Enterprise CTA Block,Pricing Page,Mid,Mid,"Show a photo, name, and title of the sales rep in your enterprise section. This humanises a cold form and increases completion. Buyers are more likely to book a call when they can see who they will be speaking with.",https://www.lemlist.com/contact-sales?utm_content=CTA_nav_bar_website ,,Not Started
,28,Waterfall Layout,Pricing Page,Low,Low,"Use a waterfall layout where features increase from left to right (fewer on the entry-level plan, more on higher tiers). Helps guide the visitor visually toward the right plan.",https://clickup.com/pricing ,,Not Started
,29,ROI Section,Pricing Page,Mid,High,Add an ROI section to clearly demonstrate the long-term benefits of your SaaS. Helps justify the price and reduces hesitation before committing.,https://www.hubspot.com/roi-calculator/marketing ,,Not Started
☐,30,Outcome Testimonials on the Pricing Page,Pricing Page,High,Low,Testimonials that mention measurable results make customer success stories more credible and help buyers evaluate potential impact.,https://www.gong.io/pricing ,,Not Started
☐,31,Custom Price Calculator for Usage-Based Pricing,Pricing Page,Mid,High,"For usage or seat-based pricing, let visitors calculate their own estimate. Personalised pricing estimates keep visitors engaged longer and give them a concrete number to take to their buying committee.",https://www.lemlist.com/pricing ,,Not Started
☐,32,Clear Plan Descriptor for Each Tier,Pricing Page,Mid,Low,"Under each plan name, add one sentence describing exactly who it is for. For example: 'Best for small sales teams getting started with outbound'. Clear plan descriptors help buyers self-select without reading every feature.",https://www.notion.com/pricing ,,Not Started
☐,33,Genuine Urgency or Scarcity Triggers,Pricing Page,Mid,Low,"If you have real promotions with real deadlines, show or highlight them as banners or pop-ups. Write the end date out as a sentence. Fake countdown timers are widely recognised by experienced B2B buyers and will destroy trust.",https://www.shopify.com/ ,,Not Started
,,,,,,,,,
📄  PRODUCT AND FEATURE PAGES,,,,,,,,,
☐,34,Benefit-Led Feature Headlines,Product Page,High,Low,"Write every feature headline as the outcome it produces, not the name of the feature. Instead of 'Automated Workflows', write 'Your team closes deals faster because follow-ups run themselves'. Outcome-focused headlines are more persuasive than technical labels.", https://slack.com/intl/en-au/features ,,Not Started
☐,35,Annotated Screenshots or Short GIFs per Feature,Product Page,High,Mid,Each feature section should have a labelled screenshot or a short looping GIF showing it working. Write descriptive alt text for each image. Visuals make features tangible and reduce the cognitive load of reading about abstract software capabilities.,https://monday.com/features/dashboards ,,Not Started
☐,36,Feature-Matched Customer Testimonials,Product Page,Mid,Low,"Pull testimonials that specifically mention the feature shown on that page. On a pipeline analytics page, use a quote from someone praising that exact feature. Page-specific testimonials are more persuasive than generic praise because they validate the specific claim being made.",https://www.hubspot.com/products/crm ,,Not Started
☐,37,ICP Pain Point Section Before the Solution,Product Page,High,Mid,"Describe the exact problem your ICP faces before introducing your solution. Use the words your customers actually use in reviews and interviews. When buyers see their own language reflected on your page, they feel understood, which builds trust before you pitch anything. If not, simply highlighting BEFORE in your headline and first fold and communicating the after through features/benefits works well too. ",https://clickup.com/ ,,Not Started
☐,38,Before and After Comparison Block,Product Page,High,Mid,Show a two-column block with the situation before and after using your product. Write each row as a plain sentence. Before/after formats are easy to scan and make the transformation concrete rather than abstract.,https://basecamp.com/ ,,Not Started
☐,39,Secondary Micro-Benefits Below Feature Headline,Product Page,Low,Low,"Under each feature headline, add one short sentence about a secondary benefit such as 'also connects to Salesforce, HubSpot, and Pipedrive in one click'. Each integration name you mention adds a keyword match for buyers searching for that specific connection.",https://asana.com/product ,,Not Started
☐,40,Sticky Side Navigation on Long Pages,Product Page,Mid,Mid,Add a fixed anchor navigation for long product pages so users can jump to sections. This improves engagement on long pages and helps visitors find what they care about without scrolling through everything.,https://qwilr.com/blog/challenger-sales-methodology/ ,,Not Started
☐,41,Compact Case Study Card per Major Feature,Product Page,Mid,Mid,"Under each major feature, add a small card with a customer name, use case, and one key result. Pairing feature descriptions with real customer outcomes is more persuasive than either alone.",https://www.pandadoc.com/rooms/ ,,Not Started
☐,42,Integrations Section with Named Logos,Product Page,Mid,Low,List your integrations by name with their logos. Write a short sentence for each major integration explaining what it does when connected to your product. Buyers searching for specific integrations need to find confirmation on your page quickly.,https://zapier.com/apps,,Not Started
☐,43,Feature Tier Comparison Table,Product Page,Mid,Mid,"If your product has multiple tiers, show a feature matrix on product pages, not only on the pricing page. Buyers researching a specific feature often arrive on product pages, not pricing pages. Give them the tier information where they are already looking.",https://clickup.com/features,,Not Started
☐,44,Feature-Specific FAQ Section,Product Page,Mid,Low,"Write five or six FAQs specific to each feature page: setup time, data security, usage limits, and comparisons to doing it manually. FAQ sections address the questions buyers have but do not ask, reducing friction before they reach the CTA.",https://www.pandadoc.com/pricing/ ,,Not Started
☐,45,Social Proof Number Near Product CTA,Product Page,Mid,Low,"Add a line near the CTA like '2,400 teams use this feature today'. Specific usage numbers build credibility at the conversion point. Generic praise does not have the same effect as a concrete number.",https://www.default.com/book-a-demo ,,Not Started
,,,,,,,,,
📝  BLOG AND CONTENT PAGES,,,,,,,,,
☐,46,Breathable Article Structure,Blog Page,High,Low,"Keep paragraphs to three sentences maximum. Use H2 and H3 headings every 300 to 400 words. Use bullet points for any list of three or more items. Well-structured content is easier to read, increases time on page, and reduces bounce rate.",https://clickup.com/blog/productivity-improvement-techniques/ ,,Not Started
☐,47,Key Takeaways Box at the Top of Every Article,Blog Page,High,Mid,Put a styled box near the top of every article that lists three to five things the reader will learn. This summary sets expectations and keeps readers engaged because they know what value is coming.,https://ro.co/weight-loss/wegovy-cost/ ,,Not Started
☐,48,Contextually Relevant Sticky CTA on Desktop,Blog Page,High,Mid,"Add a sticky sidebar or bottom bar CTA that matches the article topic. If the article covers sales automation, the CTA should link to your automation feature page, not your homepage. Topic-matched CTAs convert better than generic ones.",https://www.pandadoc.com/blog/how-to-write-a-proposal/ ,,Not Started
☐,49,Inline CTAs at Natural Article Breakpoints,Blog Page,High,Mid,Place two or three inline CTA cards inside the article at natural section breaks. Use a small product image and a short headline with a button. Inline CTAs convert better than end-of-article CTAs because they appear when the reader is most engaged with a specific topic.,https://www.pandadoc.com/blog/how-to-write-a-proposal/ ,,Not Started
☐,50,Contextual Exit Intent Pop-Up on Blog Pages,Blog Page,High,High,"When a blog visitor moves to leave, show a modal that offers something related to what they just read. A checklist, offer or template matched to the article topic will convert far better than a generic newsletter signup. Relevance to the page topic is the key variable.",https://www.semrush.com/blog/seo-checklist/ ,,Not Started
☐,51,Small or Text-Only Article Header Image,Blog Page,High,Low,Use a compact header or no hero image at all. Large hero images push your content below the fold and increase bounce rate. Getting to the substance faster keeps readers on the page.,https://www.pandadoc.com/blog/how-to-write-a-proposal/ ,,Not Started
☐,52,Author Box with Credentials Top and Bottom,Blog Page,Low,Low,"Add an author bio with a real photo, name, job title, and one-line credential at the top and bottom of every article. Attributed content builds trust with readers and aligns with Google's E-E-A-T quality guidelines.",https://www.pandadoc.com/blog/how-to-write-a-proposal/ ,,Not Started
☐,53,Pro Tips and Expert Highlight Boxes,Blog Page,Mid,Mid,"Pull key insights into styled callout boxes with a distinct background and an icon. These boxes break up long text, highlight the most important points, and give scanners a reason to stop and read.",https://clickup.com/blog/productivity-improvement-techniques/ ,,Not Started
,54,Expert Picks Inside Article,Blog Page,Mid,Mid,"Example: goodrx.com/wegovy/wegovy-for-weight-loss-cost-coverage
(This is about adding expert pick/recommendation callout boxes inside blog articles, like a highlighted ""our expert recommends"" section. Different from Pro Tips, which are more about tips/highlights.)",https://www.goodrx.com/wegovy/wegovy-for-weight-loss-cost-coverage ,,Not Started
☐,55,Clickable Table of Contents,Blog Page,Mid,Low,"For articles over 1,500 words, add a clickable table of contents near the top. A TOC improves user experience on long articles by letting readers jump to the section they care about, reducing bounce.",https://ahrefs.com/blog/keyword-research/,,Not Started
☐,56,Product Screenshots Embedded Inside Articles,Blog Page,High,Low,Add relevant product screenshots inside the article body where they naturally fit. Include descriptive alt text for each one. In-article product visuals help readers connect the advice to your product without feeling like a hard sell.,https://clickup.com/blog/productivity-improvement-techniques/ ,,Not Started
,57,Slider With Testimonials,Blog Page,Mid,Mid,"Add a testimonial slider or carousel within your blog content, especially on high-intent articles like comparisons or product reviews. It reinforces trust at the exact moment a reader is evaluating options. ",https://ro.co/weight-loss/wegovy-cost/ ,,Not Started
,58, Slider - Before & After,Blog Page,Mid,Mid,An interactive before/after slider inside blog content to visually show results or transformations.,https://www.tryeden.com/treatment/compounded-semaglutide ,,Not Started
☐,59,Comparison Tables in Roundup Posts,Blog Page,High,Mid,"For best-of and comparison articles, use a structured HTML table with tool name, key features, pricing, and a rating column. Tables are one of the most scannable content formats and help buyers compare options quickly.",https://koronapos.com/blog/best-pos-liquor-store/ ,,Not Started
☐,60,Affiliate-Style Layout for Software Review Content,Blog Page,High,High,"For review posts, structure each entry with a summary card, pros and cons list, who it is best for, pricing, and a rating. This format maps directly to how buyers make decisions and is the most effective structure for comparison content.",https://koronapos.com/blog/best-pos-liquor-store/ ,,Not Started
☐,61,Styled Conclusion Section with CTA Inside,Blog Page,Mid,Mid,Format your conclusion as a visually distinct box with a summary and a next step CTA. A clearly structured conclusion with a specific recommendation converts better than a paragraph that trails off.,https://www.goodrx.com/wegovy/wegovy-for-weight-loss-cost-coverage ,,Not Started
☐,62,References Behind a Collapsible Toggle,Blog Page,Low,Mid,Move citations to a collapsible references section at the bottom. This keeps the article readable while showing that your content is backed by sources. Cited content builds more trust than unsourced claims.,https://ro.co/weight-loss/wegovy-cost/ ,,Not Started
☐,63,Downloadable Content Upgrade Mid-Article,Blog Page,High,Mid,Offer a downloadable resource halfway through the article in exchange for an email. Match it precisely to the topic. A well-placed content upgrade captures leads from readers who are actively engaged with the content.,https://blog.hubspot.com/sales/ultimate-guide-creating-sales-plan,,Not Started
☐,64,Reading Time Estimate Near the Headline,Blog Page,Low,Low,Show an estimated reading time near the title. This sets expectations and reduces bounce from readers who are deciding whether to commit.,https://www.intercom.com/blog/hollywood-demos-vs-real-world-demos/,,Not Started
☐,65,Last Updated Date on Every Article,Blog Page,Mid,Low,Show a 'Last updated' date on every post. Fresh content ranks better in search and builds more trust with readers. An outdated date on an otherwise strong article can cause readers to question whether the advice still applies.,https://backlinko.com/learn-seo-fast ,,Not Started
☐,66,Social Share Buttons with LinkedIn Priority,Blog Page,Low,Low,"Add social share buttons prioritising LinkedIn and Twitter. For B2B SaaS content, LinkedIn shares carry the most weight because your buyers are on that platform. Make sharing frictionless.",https://contentsquare.com/guides/customer-experience/,,Not Started
☐,67,Related Articles Section at the Bottom,Blog Page,Mid,Low,"Add three manually chosen related posts at the bottom of each article. Link between awareness content, consideration content, and your pricing page. This keeps readers in your content ecosystem and moves them down the funnel.",https://www.atlassian.com/blog/strategy/enterprise-ai-roi-framework ,,Not Started
,,,,,,,,,
🗓️  DEMO AND CONTACT PAGES,,,,,,,,,
☐,68,Distraction-Free Layout with No Navigation,Demo Page,High,High,"Remove the main navigation, footer links, and any exit paths from your demo booking page. One page, one goal. This change alone can lift demo conversions by 20 to 40 percent.",https://www.default.com/book-a-demo ,,Not Started
☐,69,Outcome Testimonials Directly on the Demo Page,Demo Page,High,Mid,Place two or three testimonials on the demo booking page that include a specific result like '4x ROI in year one'. Outcome-focused quotes are the most persuasive at the moment a buyer is deciding whether to commit their time.,https://www.gong.io/demo ,,Not Started
☐,70,Customer Logos on the Demo Page,Demo Page,High,Low,Show a logo bar of recognisable customers on the demo page. Buyers need to see peer validation at the moment they are deciding whether to commit their time.,https://www.lemlist.com/pricing ,,Not Started
☐,71,Short Form with 5 Fields Maximum,Demo Page,High,Low,"Keep your demo request form to five fields: name, work email, company, team size, and one qualifying question. Every extra field reduces completion by around 10 percent.",https://slack.com/intl/en-us/contact-sales,,Not Started
☐,72,Value Bullet Points Beside the Form,Demo Page,High,Low,Put two to five bullet points next to the form explaining what happens in the demo. Write each one as a plain sentence: 'See the pipeline automation feature live' or 'Get a custom ROI estimate for your team size'. These sentences are indexed and answer the question 'what do you get from an X demo'.,https://www.storylane.io/request-demo ,,Not Started
☐,73,Confirmation Page with What Happens Next,Demo Page,Mid,Mid,"After form submission, show a proper confirmation page, not just a toast notification. Include a timeline of what happens next and links to case studies or your product tour. This page sets expectations and keeps the buyer engaged.",,,Not Started
☐,74,Inline Calendar Booking,Demo Page,High,Mid,Embed a calendar directly on the page using a tool like Calendly so prospects can book their slot without waiting for a follow-up email. Instant booking eliminates scheduling friction and dramatically shortens time to meeting.,,,Not Started
☐,75,Live Review Widget or Recent G2 Quotes,Demo Page,Mid,Low,"Embed a live review feed or paste two to three recent G2 quotes on the demo page. Recent, unedited reviews are more persuasive than polished testimonials because they feel earned.",https://offers.hubspot.com/crm-platform-demo ,,Not Started
☐,76,What to Expect Timeline Below the Form,Demo Page,Mid,Low,"Add a three-step visual below the form: 'Submit, we respond within 4 hours, you get a personalised walkthrough'. Setting clear expectations reduces post-submission anxiety and no-shows.",,,Not Started
,,,,,,,,,
🏆  SOCIAL PROOF AND TRUST,,,,,,,,,
☐,77,Optimised Testimonial Format,Site Wide,High,Low,"Every testimonial must include a real photo, full name, job title, company name, and a specific metric or outcome. Structured testimonials are more credible and persuasive than anonymous quotes.",https://www.lemlist.com/ ,,Not Started
☐,78,Testimonials Mapped to Your Top 3 Buyer Objections,Site Wide,High,Low,"Choose testimonials that directly address your top three conversion objections, not just your most enthusiastic quotes. Match social proof to the specific doubts your buyers have at each stage.",https://www.pandadoc.com/cpq-software/ ,,Not Started
☐,79,Video Testimonials on Homepage and Pricing Page,Site Wide,High,High,Record two or three short video testimonials of 60 to 90 seconds with real customers. A spoken testimonial that includes specific numbers is more persuasive than a written quote because it feels authentic and harder to fake.,https://ramp.com/,,Not Started
☐,80,Filterable Case Study Library,Site Wide,High,High,"Build a dedicated case studies page that buyers can filter by industry, company size, and use case. Filterability helps buyers find a story that matches their situation, which is far more persuasive than a generic success story.",https://www.atlassian.com/customers ,,Not Started
